{
	"$schema": "https://json-schema.org/draft/2020-12/schema",
	"$id": "https://luisz1.github.io/chronus-tabula/schema/territorio.json",
	"title": "Territorio menor (datos/territorios/<nombre>.json)",
	"description": "Ciudad-estado, colonia o enclave demasiado pequeño para los GeoJSON: se pinta como punto (o polígono) con el color de su país. El fichero se llama como su 'nombre' en minúsculas.",
	"type": "object",
	"required": [
		"nombre",
		"pais",
		"desde",
		"lat",
		"lng"
	],
	"properties": {
		"id": {
			"type": "string",
			"pattern": "^[a-z0-9-]+$",
			"description": "Identificador estable (minúsculas y guiones): es la clave de sus traducciones en datos/i18n/. No lo cambies al corregir el nombre"
		},
		"nombre": {
			"type": "string",
			"minLength": 1
		},
		"pais": {
			"type": "string",
			"description": "Nombre del país del que hereda el color (debe coincidir con 'nombre', 'nombres' o 'relacionados' de una ficha de 'paises')"
		},
		"estatus": {
			"type": "string",
			"description": "Situación jurídica o administrativa, en términos descriptivos (p. ej. «Administración militar egipcia (1948–1967)»). Si existe, la ficha lo muestra en lugar de «Parte de»; el país solo da el color."
		},
		"desde": {
			"type": "integer",
			"minimum": -123000,
			"maximum": 2100,
			"description": "Año; negativo = a. C."
		},
		"hasta": {
			"type": [
				"integer",
				"null"
			],
			"minimum": -123000,
			"maximum": 2100,
			"description": "Año (negativo = a. C.) o null/ausente"
		},
		"lat": {
			"type": "number",
			"minimum": -90,
			"maximum": 90
		},
		"lng": {
			"type": "number",
			"minimum": -180,
			"maximum": 180
		},
		"poligono": {
			"type": "array",
			"minItems": 3,
			"description": "Lista de vértices [lat, lng]",
			"items": {
				"type": "array",
				"minItems": 2,
				"maxItems": 2,
				"prefixItems": [
					{
						"type": "number",
						"minimum": -90,
						"maximum": 90
					},
					{
						"type": "number",
						"minimum": -180,
						"maximum": 180
					}
				]
			}
		},
		"descripcion": {
			"type": "string"
		},
		"wiki": {
			"type": "string",
			"minLength": 1,
			"description": "Título del artículo en Wikipedia en español (p. ej. 'Reino de Aragón'); admite prefijo de idioma ('es:…', 'en:…')"
		},
		"fuentes": {
			"type": "array",
			"description": "Toda contribución cita su fuente. 'id' es un nombre corto (p. ej. 'Wikidata:Q29'); 'consultado' es la fecha AAAA-MM o AAAA-MM-DD.",
			"items": {
				"type": "object",
				"required": [
					"id"
				],
				"properties": {
					"id": {
						"type": "string",
						"minLength": 1
					},
					"url": {
						"type": "string"
					},
					"licencia": {
						"type": "string"
					},
					"consultado": {
						"type": "string"
					}
				}
			}
		}
	}
}
