{
	"id": "cisjordania",
	"nombre": "Cisjordania",
	"pais": "Palestina",
	"estatus": "Mandato británico de Palestina (hasta mayo de 1948)",
	"desde": 1945,
	"hasta": 1947,
	"lat": 32.0,
	"lng": 35.3,
	"poligono": [
		[
			32.55,
			35.56
		],
		[
			32.55,
			35.22
		],
		[
			32.42,
			35.0
		],
		[
			32.15,
			34.96
		],
		[
			31.95,
			34.98
		],
		[
			31.84,
			34.97
		],
		[
			31.8,
			35.06
		],
		[
			31.79,
			35.17
		],
		[
			31.71,
			35.16
		],
		[
			31.62,
			34.98
		],
		[
			31.42,
			34.97
		],
		[
			31.36,
			35.12
		],
		[
			31.38,
			35.46
		],
		[
			31.75,
			35.53
		],
		[
			32.2,
			35.56
		]
	],
	"descripcion": "Hasta la retirada británica y la proclamación de Israel (mayo de 1948) todo el territorio era el Mandato británico de Palestina; el mapa base de 1945 ya rotula «Israel». Este polígono señala la extensión aproximada de Cisjordania según las líneas de armisticio de 1949, para dar continuidad a los periodos siguientes.",
	"wiki": "Cisjordania",
	"fuentes": [
		{
			"id": "wikipedia-es:Cisjordania",
			"url": "https://es.wikipedia.org/wiki/Cisjordania",
			"licencia": "CC BY-SA",
			"consultado": "2026-09-09"
		},
		{
			"id": "wikipedia-es:Mandato británico de Palestina",
			"url": "https://es.wikipedia.org/wiki/Mandato_brit%C3%A1nico_de_Palestina",
			"licencia": "CC BY-SA",
			"consultado": "2026-09-09"
		}
	]
}
