{
	"id": "dinastia-shang",
	"nombre": "Dinastía Shang",
	"pais": "Dinastía Shang",
	"desde": -1600,
	"hasta": -1046,
	"lat": 36.1,
	"lng": 114.35,
	"poligono": [
		[
			38.3,
			112.2
		],
		[
			38.3,
			115.0
		],
		[
			36.2,
			116.3
		],
		[
			34.0,
			115.4
		],
		[
			33.7,
			112.8
		],
		[
			35.4,
			111.2
		]
	],
	"descripcion": "Primera dinastía china documentada; capital final en Yin (Anyang). Fundada por Cheng Tang; su bronce ritual y los huesos oraculares son las primeras muestras de escritura china. El último rey, Di Xin, cae ante los Zhou en Muye (1046 a. C.).",
	"wiki": "Dinastía Shang",
	"fuentes": [
		{
			"id": "wikipedia-es:Dinastía Shang",
			"url": "https://es.wikipedia.org/wiki/Dinastía_Shang",
			"licencia": "CC BY-SA",
			"consultado": "2026-09-07"
		}
	]
}
